{
  "$schema": "http://json-schema.org/draft-07/schema#",
  "title": "Snowflake Extraction Configuration Schema",
  "description": "Schema for validating Snowflake extraction configuration",
  "type": "object",
  "properties": {
    "batch_size": {
      "type": "integer",
      "minimum": 1,
      "maximum": 100000,
      "description": "Number of records to extract in each batch"
    },
    "max_batches": {
      "type": "integer",
      "minimum": 1,
      "maximum": 1000,
      "description": "Maximum number of batches to process in a single execution"
    },
    "max_retries": {
      "type": "integer",
      "minimum": 0,
      "maximum": 10,
      "description": "Maximum number of retry attempts for failed operations"
    },
    "output_format": {
      "type": "string",
      "enum": ["parquet", "json"],
      "description": "Output file format for extracted data"
    },
    "validation_rules": {
      "type": "object",
      "properties": {
        "min_rows": {
          "type": "integer",
          "minimum": 0,
          "description": "Minimum number of rows expected in extraction"
        },
        "required_columns": {
          "type": "array",
          "items": {
            "type": "string"
          },
          "description": "List of columns that must be present in extracted data"
        },
        "non_null_columns": {
          "type": "array",
          "items": {
            "type": "string"
          },
          "description": "List of columns that should not contain null values"
        }
      }
    },
    "queries": {
      "type": "array",
      "items": {
        "type": "object",
        "properties": {
          "name": {
            "type": "string",
            "description": "Unique name for the query/table"
          },
          "sql": {
            "type": "string",
            "description": "SQL query to execute"
          },
          "watermark_column": {
            "type": "string",
            "description": "Column used for incremental extraction"
          },
          "partition_by": {
            "type": "string",
            "enum": ["date", "hour", "custom"],
            "default": "date",
            "description": "Partitioning strategy for S3 storage"
          },
          "enable_batching": {
            "type": "boolean",
            "default": true,
            "description": "Enable batch processing for this query"
          }
        },
        "required": ["name", "sql"]
      }
    }
  },
  "required": ["batch_size", "max_batches", "max_retries", "output_format", "queries"]
}